{
  "$schema": "../../tools/registry/schema/domain-module.schema.json",
  "id": "capabilities",
  "kind": "domain",
  "owner": "platform",
  "directory": "packages/capabilities",
  "description": "Communication-service discovery and governed Operation Permission capabilities.",
  "publicApi": [
    "#meshrix/capabilities/operation-permission-core/index",
    "#meshrix/capabilities/operation-permission-core/runtime-schema",
    "#meshrix/capabilities/operation-permission-core/store",
    "#meshrix/capabilities/skills/tool-skill-management-provider"
  ],
  "dependsOn": [
    "contracts",
    "foundation",
    "protocols"
  ],
  "sourceOwnership": [
    {
      "feature": "communication-service",
      "path": "src/communication-service",
      "fileCount": 3,
      "testSuites": [
        "communication-service.runtime"
      ]
    },
    {
      "feature": "gateway-credentials",
      "path": "src/gateway-credentials",
      "fileCount": 1,
      "testSuites": [
        "gateway.*"
      ]
    },
    {
      "feature": "gateway-policy",
      "path": "src/gateway-policy",
      "fileCount": 1,
      "testSuites": [
        "gateway.*"
      ]
    },
    {
      "feature": "operation-permission-core",
      "path": "src/operation-permission-core",
      "fileCount": 43,
      "testSuites": [
        "governance.operation-permission-protocol-consistency"
      ]
    },
    {
      "feature": "skills",
      "path": "src/skills",
      "fileCount": 6,
      "testSuites": [
        "downstream-mcp.installer-convergence"
      ]
    }
  ]
}
